{
  "_generated": "ptfkit-codegen; DO NOT EDIT.",
  "schema_version": 1,
  "ptfkit_version": "0.0.0-test",
  "coverage": {
    "implemented_functions": 1,
    "manifest_functions": 1,
    "omitted_functions": []
  },
  "units": {
    "mass_percent": {
      "preferred_notation": "% w/w",
      "aliases": ["%"],
      "conversion": {"dimension": "mass_ratio", "scale_to_si": 0.01, "offset_to_si": 0.0}
    },
    "micrometer": {
      "preferred_notation": "µm",
      "aliases": ["um"],
      "conversion": {"dimension": "length", "scale_to_si": 0.000001, "offset_to_si": 0.0}
    },
    "volume_fraction": {
      "preferred_notation": "m^3/m^3",
      "aliases": ["cm^3/cm^3"],
      "conversion": {"dimension": "volume_ratio", "scale_to_si": 1.0, "offset_to_si": 0.0}
    },
    "kilopascal": {
      "preferred_notation": "kPa",
      "aliases": [],
      "conversion": {"dimension": "pressure", "scale_to_si": 1000.0, "offset_to_si": 0.0}
    },
    "millimeter_per_hour": {
      "preferred_notation": "mm/h",
      "aliases": [],
      "conversion": {"dimension": "length_per_time", "scale_to_si": 2.7777777777777776e-7, "offset_to_si": 0.0}
    },
    "meter_per_second": {
      "preferred_notation": "m/s",
      "aliases": [],
      "conversion": {"dimension": "length_per_time", "scale_to_si": 1.0, "offset_to_si": 0.0}
    }
  },
  "quantities": {
    "particle_mass_fraction": {
      "description": "Particle mass fraction.",
      "units": ["mass_percent"]
    },
    "volumetric_water_content": {
      "description": "Volumetric water content.",
      "units": ["volume_fraction"]
    },
    "matric_potential": {
      "description": "Matric-potential magnitude.",
      "units": ["kilopascal"]
    },
    "saturated_hydraulic_conductivity": {
      "description": "Saturated hydraulic conductivity.",
      "units": ["millimeter_per_hour", "meter_per_second"]
    }
  },
  "functions": [
    {
      "id": "calc_ptf_example",
      "source": "example2026",
      "module": "ptfkit.example2026",
      "callable": "calc_ptf_example",
      "status": "implemented",
      "models": {"h_theta": null, "k_h": "Saturated conductivity"},
      "warnings": [],
      "inputs": [
        {
          "kind": "numeric",
          "name": "clay",
          "measurement": {
            "quantity": "particle_mass_fraction",
            "unit": "mass_percent",
            "reported_unit": "%",
            "basis": {"material": "fine_earth", "denominator": "dry_mass"},
            "particle_size": {
              "unit": "micrometer",
              "lower": null,
              "upper": {"value": 2.0, "inclusive": false}
            },
            "conditions": [],
            "status": "required",
            "method": null,
            "role": "predictor",
            "computational_domain": {
              "lower": {"value": 0.0, "inclusive": true},
              "upper": {"value": 100.0, "inclusive": true}
            },
            "reported_applicability": []
          }
        }
      ],
      "outputs": [
        {
          "kind": "numeric",
          "name": "theta_33",
          "measurement": {
            "quantity": "volumetric_water_content",
            "unit": "volume_fraction",
            "reported_unit": "m^3/m^3",
            "basis": {"material": "fine_earth", "denominator": "bulk_volume"},
            "particle_size": null,
            "conditions": [
              {"quantity": "matric_potential", "value": 33.0, "unit": "kilopascal", "convention": "magnitude"}
            ],
            "status": "estimated",
            "method": null,
            "role": "prediction",
            "computational_domain": {
              "lower": {"value": 0.0, "inclusive": true},
              "upper": {"value": 1.0, "inclusive": true}
            },
            "reported_applicability": []
          }
        },
        {
          "kind": "numeric",
          "name": "saturated_conductivity",
          "measurement": {
            "quantity": "saturated_hydraulic_conductivity",
            "unit": "millimeter_per_hour",
            "reported_unit": "mm/h",
            "basis": {"material": "fine_earth", "denominator": "not_applicable"},
            "particle_size": null,
            "conditions": [],
            "status": "estimated",
            "method": null,
            "role": "prediction",
            "computational_domain": {
              "lower": {"value": 0.0, "inclusive": true},
              "upper": null
            },
            "reported_applicability": []
          }
        }
      ]
    }
  ]
}
